id,Article Link,Article Title
6,https://www.dailymail.co.uk/news/article-10470655/Georgetown-Law-accused-hypocrisy-firing-professor-disapproved-Bidens-SCOTUS-nominee.html,Georgetown Law is accused of hypocrisy after firing prof who tweeted Biden's SCOTUS nominee would not be the best pick but a 'lesser Black woman' - after failing to sanction staffer who said students should not clerk for Trump judges
11,https://www.dailymail.co.uk/news/article-10470815/More-3-600-flights-cancelled-Thursday-powerful-winter-storm.html,"3,500 flights will be canceled across the US Thursday as powerful winter storm slams into Midwest and the Northeast: 78% of flights out of St. Louis and 38% of flights from Chicago were grounded Wednesday "
13,https://www.dailymail.co.uk/news/article-10468479/Kansas-woman-charged-joining-ISIS-seen-school-photo-decades-radicalized.html,How 'caring' Kansas girl went from 'intelligent student who loved science and photography' to machine gun-toting ISIS jihadi who led an all-female battalion in Syria
27,https://www.dailymail.co.uk/femail/article-10468475/JFKs-application-essay-Harvard-not-impressive.html,JFK's VERY underwhelming Harvard application goes viral after his grandson graduated from the Ivy League school: Twitter mocks entitled essay about wanting to attend same college as his dad 
37,https://www.dailymail.co.uk/news/article-10469829/FBI-investigates-recent-bomb-threats-historically-black-colleges-violent-extremism.html,FBI investigates bomb threats against a dozen historically black colleges as 'racially motivated violent extremism' made by 'six tech savvy juveniles' on the first day of Black History Month
41,https://www.dailymail.co.uk/news/article-10469991/MO-teacher-married-student-accused-having-sex-child-him.html,"PICTURED: Missouri teacher, 26, her student lover who she married to avoid jail, and their BABY "
